[
  {
    "id": "how-to-keep-your-core-message-when-your-speaking-time-is-cut-short",
    "title": "How to Keep Your Core Message When Your Speaking Time Is Cut Short",
    "category": "Article",
    "summary": "By Fandi Hasib If you have prepared a ten-minute presentation and are told just before going on stage that you now have only five minutes, my advice is to first identify the one conclusion your audience most needs to…",
    "readTime": "5 min",
    "date": "2026-10-12",
    "tags": [
      "Article"
    ],
    "body": {
      "intro": "By Fandi Hasib</p><p>If you have prepared a ten-minute presentation and are told just before going on stage that you now have only five minutes, my advice is to first identify the one conclusion your audience most needs to take away. Keep the key evidence that supports it and the next step they can take, then remove secondary examples. Delivering one complete line of reasoning at a normal pace is more useful than rushing through every slide. This article offers an order for cutting material, a five-minute rehearsal plan, and a way to wrap up when you are asked to finish midway through your talk.</p><p>I am Fandi Hasib. I have worked in Indonesia as a journalist, television news anchor, and producer, and I also teach public speaking and BIPA, or Indonesian for non-native speakers. I participate in the creator education programme of PT. Otto Media Grup, focusing on public speaking and content production. Through this collaboration, I have also had opportunities to teach public speaking courses to the public. When adapting a talk to different time limits, I recommend starting with one question: “What does the audience need to understand?”",
      "heading1": "Identify the One Sentence That Must Stay",
      "section1": "Before shortening your talk, write down in one sentence what you want your audience to understand or do. Suppose you are presenting a plan for developing short-form video topics. Your core message might be: “Identify one audience question before writing the script.” That sentence can guide action. “Today, I’ll introduce our complete content plan” merely describes the scope of the presentation; it does not help you decide what to cut.</p><p>Next, review your original draft paragraph by paragraph. Does each paragraph explain the core conclusion, provide essential support, or describe how to put it into practice? If it does none of these, it can be among the first things removed from the live presentation. Some background may be necessary, but include only enough for the audience to assess the issue. You do not need to retrace your entire preparation process.",
      "quote": "",
      "heading2": "Cut Examples, but Keep the Conditions That Matter",
      "section2": "I recommend removing repeated explanations first, reducing similar examples next, and compressing the background last. Do not remove a qualification simply because it makes a sentence longer. For example: “You can start with a small test shoot to check the script, but feedback from that test does not represent the entire audience.” The second half defines the limits of the conclusion and is worth keeping.</p><p>If your original draft contains three examples, choose the one most relevant to the audience in front of you and explain its context, the choice made, and the reasoning behind it. Units of measurement, comparison benchmarks, the people or situations a claim applies to, and any risks that need explaining must not disappear simply because time is short. The information you retain should be sufficient to support the conclusions you still present.</p><p><strong>Use Five Minutes to Deliver One Complete Line of Reasoning</strong></p><p>The following is a practice example for turning a ten-minute talk into a five-minute version, not a standard that applies to every presentation. Here, the five minutes cover speaking time only and do not include a separate Q&amp;A session. The speaking sections total 280 seconds, leaving another 20 seconds for pauses or live transitions.</p><p><img src=\"assets/github-how-to-keep-your-core-message-when-your-speaking-time-is-cut-short-1.png\" alt=\"\" loading=\"lazy\"></p><p>For rehearsal, I recommend recording two consecutive run-throughs. In the first, deliver the revised structure in full and time it. In the second, work only on the section that runs furthest over its allotted time. Do not shorten every sentence to the point where it becomes difficult to understand. If you are still over time, narrow the problem you promise to address rather than continually increasing your speaking speed.</p><p><strong>How to Wrap Up Naturally When You Receive a Time Reminder Midway Through</strong></p><p>Finish your current sentence, then use one sentence to signal where you are heading next. For example: “I’ll now focus on the one step you can take today.” Then move to the ending you prepared in advance so the audience hears a complete recommendation for action. This sentence is an example of a transition, not a script you must memorise.</p><p>If you have only one minute left, you could spend 20 seconds summarising the conclusion, 20 seconds adding the key conditions, and 20 seconds explaining the action to take. These timings are only rehearsal guidelines. If a decision requires more evidence than you have time to present, clearly identify the questions that still need to be checked rather than rushing the audience into a judgement.</p><p>In Media Tech and creator education settings, the same topic may be used in an open class, a livestream, or a brand proposal. For creators participating in the education programme of PT. Otto Media Grup, preparing scripts of different lengths can become part of content production. Each version must make sense on its own; it should not simply be a longer script cut off at an arbitrary point.</p><p><strong>Frequently Asked Questions</strong></p><p><strong>Should I Apologise to the Audience First?</strong></p><p>A brief explanation of the change in scope is enough. Spending the time clarifying your revised focus is more helpful than repeatedly explaining why you cannot cover everything.</p><p><strong>Does a Five-Minute Version Need to Keep All the Original Subheadings?</strong></p><p>No. Subheadings are there to support understanding and can be merged or removed. However, evidence and qualifications directly related to the conclusion should remain.</p><p><strong>Can I Put Everything I Leave Out into the Q&amp;A?</strong></p><p>Do not assume that Q&amp;A time is yours to use. You can provide supplementary materials and follow the moderator arrangements. Any explanation essential to the core judgement should still be included in the main talk.</p><p><strong>How Can I Tell Whether the Shortened Version Is Clear?</strong></p><p>Ask a rehearsal partner to restate your main point and the next action, then ask what they are still unsure about. Their response can help you identify gaps in the explanation, but it is not data proving how the talk will work with a real audience.</p><p><strong>Closing Thoughts</strong></p><p>The next time you prepare a talk, I recommend writing the ending early and keeping a shorter version of the same topic ready. Even when your time is reduced, the audience should still understand what the problem is, why you have reached your conclusion, and what they can do next.</p><p><img src=\"assets/github-how-to-keep-your-core-message-when-your-speaking-time-is-cut-short-2.png\" alt=\"\" loading=\"lazy\">",
      "close": ""
    },
    "status": "published"
  },
  {
    "id": "how-creators-can-make-a-content-series-recognizable-fandi-hasib-presents-a-three",
    "title": "How Creators Can Make a Content Series Recognizable: Fandi Hasib Presents a Three-Layer Approach",
    "category": "Article",
    "summary": "By Fandi Hasib Build a series around one core question, a consistent content structure, and a small set of recognizable elements. Each installment can then offer something new while remaining part of a series audiences…",
    "readTime": "5 min",
    "date": "2026-10-10",
    "tags": [
      "Article"
    ],
    "body": {
      "intro": "By Fandi Hasib</p><p>Build a series around one core question, a consistent content structure, and a small set of recognizable elements. Each installment can then offer something new while remaining part of a series audiences remember.</p><p>A recognizable content series does not need the same visuals in every installment or a slogan repeated word for word. What matters is that audiences know what problem the series continues to address, how it approaches that problem, and what helps them recognize it. I usually design a series in three layers: a consistent question, a consistent structure, and consistent identifying elements. Once those layers are clear, each installment can change without losing its connection to the others.</p><p>I am Fandi Hasib. I have worked in Indonesian television news and program production, as well as public speaking, presenting, content creation, and teaching Indonesian through BIPA. I am involved in the influencer education program of PT. Otto Media Grup, with a focus on public speaking and content production. For creators, building a series is not about making every installment identical. It is about helping audiences trust that they know what they will gain next time.",
      "heading1": "Start with a Question Your Audience Encounters Repeatedly",